{"schema_version":"1.0","id":"hair-style","version":"1.0.0","display_name":"Hair Style","options":[{"id":"loose-hair","text":"The hair is worn loose in a simple natural style","weight":1.3,"tags":["loose","natural"],"status":"active"},{"id":"neat-side-part","text":"The hair is arranged in a neat side part","weight":1.0,"tags":["neat","professional"],"status":"active"},{"id":"casual-top-knot","text":"The hair is gathered into a casual top knot","weight":0.7,"tags":["casual","updo"],"status":"active","requires":[{"field":"hair-length","operator":"in","value":["medium-hair","long-hair"]}]}],"fallback_option_id":"loose-hair"}
