{"schema_version":"1.0","id":"expression","version":"1.0.0","display_name":"Expression","options":[{"id":"calm-expression","text":"Their expression is calm and attentive","weight":1.2,"tags":["calm","neutral"],"status":"active"},{"id":"gentle-smile","text":"They show a gentle natural smile","weight":1.0,"tags":["friendly","smile"],"status":"active"},{"id":"focused-expression","text":"Their expression is focused and composed","weight":0.8,"tags":["focused","neutral"],"status":"active"}],"fallback_option_id":"calm-expression"}
