{"schema_version":"1.0","id":"lighting","version":"1.0.0","display_name":"Lighting","options":[{"id":"soft-window-light","text":"Soft window light shapes the face with gentle shadows","weight":1.2,"tags":["soft","natural"],"status":"active"},{"id":"diffused-studio-light","text":"Diffused studio light produces even natural contrast","weight":1.0,"tags":["studio","diffused"],"status":"active"},{"id":"overcast-daylight","text":"Soft overcast daylight creates balanced tones","weight":0.8,"tags":["outdoor","soft"],"status":"active","requires":[{"field":"location","operator":"equals","value":"urban-street"}]}],"fallback_option_id":"soft-window-light"}
