{"schema_version":"1.0","id":"eyes","version":"1.0.0","display_name":"Eyes","options":[{"id":"brown-eyes","text":"Their eyes are warm brown with natural catchlights","weight":1.2,"tags":["brown","natural"],"status":"active"},{"id":"blue-eyes","text":"Their eyes are clear blue with natural catchlights","weight":0.8,"tags":["blue","natural"],"status":"active"}],"fallback_option_id":"brown-eyes"}
