{"schema_version":"1.0","id":"quality","version":"1.0.0","display_name":"Quality","options":[{"id":"natural-photographic-detail","text":"Natural photographic detail, realistic materials, and coherent anatomy","weight":1.2,"tags":["photographic","realistic"],"status":"active"},{"id":"clean-dataset-detail","text":"Clean consistent detail, realistic proportions, and restrained processing","weight":0.8,"tags":["dataset","realistic"],"status":"active"}],"fallback_option_id":"natural-photographic-detail"}
