{"schema_version":"1.0","id":"hair-length","version":"1.0.0","display_name":"Hair Length","options":[{"id":"short-hair","text":"Their hair is cut short","weight":0.9,"tags":["short"],"status":"active"},{"id":"medium-hair","text":"Their hair falls to a medium length","weight":1.1,"tags":["medium"],"status":"active"},{"id":"long-hair","text":"Their hair falls past the shoulders","weight":1.0,"tags":["long"],"status":"active"}],"fallback_option_id":"medium-hair"}
