{"schema_version":"1.0","id":"identity","version":"1.0.0","display_name":"Identity","options":[{"id":"distinct-natural-features","text":"They have distinct natural facial features and a consistent adult identity","weight":1.0,"tags":["consistent","natural"],"status":"active"},{"id":"balanced-facial-features","text":"They have balanced facial features and a clearly defined adult identity","weight":1.0,"tags":["consistent","balanced"],"status":"active"}],"fallback_option_id":"distinct-natural-features"}
