{"schema_version":"1.0","id":"body","version":"1.0.0","display_name":"Body","options":[{"id":"average-build","text":"They have a natural average adult build","weight":1.2,"tags":["average","adult"],"status":"active"},{"id":"athletic-build","text":"They have a naturally athletic adult build","weight":0.8,"tags":["athletic","adult"],"status":"active"}],"fallback_option_id":"average-build"}
