{"schema_version":"1.0","id":"pose","version":"1.0.0","display_name":"Pose","options":[{"id":"relaxed-standing","text":"They stand in a relaxed balanced pose","weight":1.2,"tags":["standing","simple"],"status":"active"},{"id":"natural-seated","text":"They sit in a natural upright pose","weight":0.9,"tags":["seated","simple"],"status":"active","excludes":[{"field":"outfit","operator":"equals","value":"evening-dress"}]},{"id":"three-quarter-turn","text":"They turn slightly in a natural three-quarter pose","weight":1.0,"tags":["standing","three-quarter"],"status":"active"}],"fallback_option_id":"relaxed-standing"}
