{"schema_version":"1.0","id":"camera","version":"1.0.0","display_name":"Camera","options":[{"id":"portrait-lens","text":"A portrait lens gives natural facial perspective and shallow depth of field","weight":1.2,"tags":["portrait","shallow-depth"],"status":"active"},{"id":"standard-lens","text":"A standard lens gives realistic perspective and moderate depth of field","weight":1.0,"tags":["standard","realistic"],"status":"active"}],"fallback_option_id":"portrait-lens"}
