{"schema_version":"1.0","id":"hair-texture","version":"1.0.0","display_name":"Hair Texture","options":[{"id":"straight-hair","text":"The hair has a naturally straight texture","weight":1.0,"tags":["straight"],"status":"active"},{"id":"wavy-hair","text":"The hair has a soft natural wave","weight":1.2,"tags":["wavy"],"status":"active"},{"id":"curly-hair","text":"The hair has a defined natural curl","weight":0.8,"tags":["curly"],"status":"active"}],"fallback_option_id":"wavy-hair"}
