{"schema_version":"1.0","id":"skin","version":"1.0.0","display_name":"Skin","options":[{"id":"natural-skin-texture","text":"Natural skin texture remains visible with realistic tonal variation","weight":1.2,"tags":["natural","realistic"],"status":"active"},{"id":"warm-skin-tones","text":"Warm natural skin tones retain realistic texture","weight":0.8,"tags":["warm","realistic"],"status":"active"}],"fallback_option_id":"natural-skin-texture"}
