{"schema_version":"1.0","id":"composition","version":"1.0.0","display_name":"Composition","options":[{"id":"head-and-shoulders","text":"The composition is a centered head-and-shoulders portrait","weight":1.1,"tags":["portrait","close"],"status":"active"},{"id":"three-quarter-frame","text":"The composition uses a balanced three-quarter frame","weight":1.0,"tags":["medium","balanced"],"status":"active"},{"id":"full-body-frame","text":"The composition shows a balanced full-body frame","weight":0.7,"tags":["full-body","balanced"],"status":"active"}],"fallback_option_id":"head-and-shoulders"}
