{"schema_version":"1.0","id":"face","version":"1.0.0","display_name":"Face","options":[{"id":"oval-face","text":"Their face has a natural oval shape","weight":1.1,"tags":["oval","natural"],"status":"active"},{"id":"angular-face","text":"Their face has softly angular contours","weight":0.9,"tags":["angular","natural"],"status":"active"}],"fallback_option_id":"oval-face"}
