{"schema_version":"1.0","id":"subjects","version":"1.0.0","display_name":"Subjects","options":[{"id":"adult-woman","text":"A photographed adult woman","weight":1.0,"tags":["adult","woman"],"status":"active"},{"id":"adult-man","text":"A photographed adult man","weight":1.0,"tags":["adult","man"],"status":"active"},{"id":"adult-person","text":"A photographed adult person","weight":0.8,"tags":["adult","person"],"status":"active"}],"fallback_option_id":"adult-person"}
