{"schema_version":"1.0","id":"mouth","version":"1.0.0","display_name":"Mouth","options":[{"id":"relaxed-lips","text":"Their lips rest in a relaxed natural position","weight":1.0,"tags":["relaxed","natural"],"status":"active"},{"id":"subtle-smile","text":"Their lips form a subtle closed-mouth smile","weight":1.0,"tags":["smile","natural"],"status":"active"}],"fallback_option_id":"relaxed-lips"}
