{"schema_version":"1.0","id":"outfit","version":"1.0.0","display_name":"Outfit","options":[{"id":"casual-jacket","text":"They wear a clean casual jacket over a simple shirt","weight":1.3,"tags":["casual","daywear"],"status":"active"},{"id":"formal-suit","text":"They wear a tailored formal suit with understated details","weight":0.9,"tags":["formal","professional"],"status":"active"},{"id":"evening-dress","text":"They wear an elegant adult evening dress","weight":0.8,"tags":["formal","evening"],"status":"active"}],"fallback_option_id":"casual-jacket"}
