{"schema_version":"1.0","id":"hair-color","version":"1.0.0","display_name":"Hair Color","options":[{"id":"brown-hair","text":"Their hair is a natural chestnut brown","weight":1.2,"tags":["brown","natural"],"status":"active"},{"id":"black-hair","text":"Their hair is a natural deep black","weight":1.0,"tags":["black","natural"],"status":"active"},{"id":"blonde-hair","text":"Their hair is a natural dark blonde","weight":0.8,"tags":["blonde","natural"],"status":"active"}],"fallback_option_id":"brown-hair"}
